root@p4:~/tutorials/DecisionTrees2# tcpdump
tcpdump: verbose output suppressed, use -v or -vv for full protocol decode
listening on eth0, link-type EN10MB (Ethernet), capture size 262144 bytes
01:52:11.898225 IP6 fe80::cc5f:b4ff:fe5c:945a > ip6-allrouters: ICMP6, router solicitation, length 16
01:53:15.397190 IP6 fe80::cc5f:b4ff:fe5c:945a > ip6-allrouters: ICMP6, router solicitation, length 16
01:54:03.027049 IP 10.0.1.140.3180 > 10.0.1.24.2661: Flags [S], seq 13579, win 8192, length 0
01:54:11.315624 IP 10.0.1.151.48899 > 10.0.1.208.49407: Flags [S], seq 13579, win 8192, length 0
01:54:46.588075 IP 10.0.1.208.3191 > 10.0.1.148.40571: Flags [S], seq 13579, win 8192, length 0
01:55:18.273997 IP6 fe80::cc5f:b4ff:fe5c:945a > ip6-allrouters: ICMP6, router solicitation, length 16
01:55:32.304589 IP 10.0.1.215.3614 > 10.0.1.103.63287: Flags [S], seq 13579, win 8192, length 0
01:55:51.375273 IP 10.0.1.173.4400 > 10.0.1.143.45166: Flags [S], seq 13579, win 8192, length 0
01:56:05.411244 IP 10.0.1.213.4720 > 10.0.1.39.8908: Flags [S], seq 13579, win 8192, length 0
01:56:24.519337 IP 10.0.1.174.49086 > 10.0.1.26.40408: Flags [S], seq 13579, win 8192, length 0
01:56:53.483425 IP 10.0.1.142.3728 > 10.0.1.75.6088: Flags [S], seq 13579, win 8192, length 0
01:57:01.775274 IP 10.0.1.70.4676 > 10.0.1.246.58846: Flags [S], seq 13579, win 8192, length 0
01:57:22.467975 IP 10.0.1.17.3338 > 10.0.1.211.33763: Flags [S], seq 13579, win 8192, length 0
01:57:36.479245 IP 10.0.1.170.3566 > 10.0.1.69.35497: Flags [S], seq 13579, win 8192, length 0
01:57:44.763434 IP 10.0.1.32.4020 > 10.0.1.183.52745: Flags [S], seq 13579, win 8192, length 0
01:59:26.098262 IP6 fe80::cc5f:b4ff:fe5c:945a > ip6-allrouters: ICMP6, router solicitation, length 16
02:07:53.978342 IP6 fe80::cc5f:b4ff:fe5c:945a > ip6-allrouters: ICMP6, router solicitation, length 16
^C
17 packets captured
17 packets received by filter
0 packets dropped by kernel
root@p4:~/tutorials/DecisionTrees2#
